{
  "plan": "copilot-business",
  "service": "vscode",
  "tier": "pro",
  "price": "$19/user/mo",
  "models": {
    "fast": "Claude Haiku 4.5 (copilot)",
    "default": "Claude Sonnet 4.6 (copilot)",
    "premium": "Claude Opus 4.6 (copilot)"
  },
  "agent_overrides": {
    "apollo": "GPT-5 mini (copilot)",
    "aphrodite": "Gemini 3.1 Pro (copilot)",
    "nyx": "GPT-5.4 mini (copilot)",
    "talos": "GPT-5.4 mini (copilot)",
    "iris": "Claude Haiku 4.5 (copilot)",
    "mnemosyne": "Claude Haiku 4.5 (copilot)"
  },
  "handoff_models": {
    "zeus__themis": "Claude Opus 4.6 (copilot)",
    "iris__zeus": "GPT-5.3-Codex (copilot)"
  },
  "limits": {
    "monthlyRequests": 300,
    "notes": "300 premium requests/user/mo. Admin controls. IP indemnity."
  }
}
