{
  "plan": "claude-pro",
  "service": "claude",
  "tier": "pro",
  "price": "$20/mo",
  "models": {
    "fast": "claude-haiku-4-5-20250514",
    "default": "claude-sonnet-4-6-20250514",
    "premium": "claude-opus-4-6-20250514"
  },
  "agent_overrides": {
    "apollo": "claude-haiku-4-5-20250514",
    "iris": "claude-haiku-4-5-20250514",
    "mnemosyne": "claude-haiku-4-5-20250514",
    "talos": "claude-haiku-4-5-20250514",
    "nyx": "claude-haiku-4-5-20250514"
  },
  "limits": {
    "monthlyRequests": null,
    "notes": "~45 messages per 5h window. Claude Code included."
  }
}
